code,title,Level
111110,Soybean Farming,6
111120,Oilseed (except Soybean) Farming,6
111130,Dry Pea and Bean Farming,6
111140,Wheat Farming,6
111150,Corn Farming,6
111160,Rice Farming,6
111191,Oilseed and Grain Combination Farming,6
111199,All Other Grain Farming,6
111211,Potato Farming,6
111219,Other Vegetable (except Potato) and Melon Farming,6
111310,Orange Groves,6
111320,Citrus (except Orange) Groves,6
111331,Apple Orchards,6
111332,Grape Vineyards,6
111333,Strawberry Farming,6
111334,Berry (except Strawberry) Farming,6
111335,Tree Nut Farming,6
111336,Fruit and Tree Nut Combination Farming,6
111339,Other Noncitrus Fruit Farming,6
111411,Mushroom Production,6
111419,Other Food Crops Grown Under Cover,6
111421,Nursery and Tree Production,6
111422,Floriculture Production,6
111910,Tobacco Farming,6
111920,Cotton Farming,6
111930,Sugarcane Farming,6
111940,Hay Farming,6
111991,Sugar Beet Farming,6
111992,Peanut Farming,6
111998,All Other Miscellaneous Crop Farming,6
112111,Beef Cattle Ranching and Farming,6
112112,Cattle Feedlots,6
112120,Dairy Cattle and Milk Production,6
112130,Dual-Purpose Cattle Ranching and Farming,6
112210,Hog and Pig Farming,6
112310,Chicken Egg Production,6
112320,Broilers and Other Meat Type Chicken Production,6
112330,Turkey Production,6
112340,Poultry Hatcheries,6
112390,Other Poultry Production,6
112410,Sheep Farming,6
112420,Goat Farming,6
112511,Finfish Farming and Fish Hatcheries,6
112512,Shellfish Farming,6
112519,Other Aquaculture,6
112910,Apiculture,6
112920,Horses and Other Equine Production,6
112930,Fur-Bearing Animal and Rabbit Production,6
112990,All Other Animal Production,6
113110,Timber Tract Operations,6
113210,Forest Nurseries and Gathering of Forest Products,6
113310,Logging,6
114111,Finfish Fishing,6
114112,Shellfish Fishing,6
114119,Other Marine Fishing,6
114210,Hunting and Trapping,6
115111,Cotton Ginning,6
115112,"Soil Preparation, Planting, and Cultivating",6
115113,"Crop Harvesting, Primarily by Machine",6
115114,Postharvest Crop Activities (except Cotton Ginning),6
115115,Farm Labor Contractors and Crew Leaders,6
115116,Farm Management Services,6
115210,Support Activities for Animal Production,6
115310,Support Activities for Forestry,6
211120,Crude Petroleum Extraction,6
211130,Natural Gas Extraction,6
212114,Surface Coal Mining,6
212115,Underground Coal Mining,6
212210,Iron Ore Mining,6
212220,Gold Ore and Silver Ore Mining,6
212230,"Copper, Nickel, Lead, and Zinc Mining",6
212290,Other Metal Ore Mining,6
212311,Dimension Stone Mining and Quarrying,6
212312,Crushed and Broken Limestone Mining and Quarrying,6
212313,Crushed and Broken Granite Mining and Quarrying,6
212319,Other Crushed and Broken Stone Mining and Quarrying,6
212321,Construction Sand and Gravel Mining,6
212322,Industrial Sand Mining,6
212323,"Kaolin, Clay, and Ceramic and Refractory Minerals Mining",6
212390,Other Nonmetallic Mineral Mining and Quarrying,6
213111,Drilling Oil and Gas Wells,6
213112,Support Activities for Oil and Gas Operations,6
213113,Support Activities for Coal Mining,6
213114,Support Activities for Metal Mining,6
213115,Support Activities for Nonmetallic Minerals (except Fuels) Mining,6
221111,Hydroelectric Power Generation,6
221112,Fossil Fuel Electric Power Generation,6
221113,Nuclear Electric Power Generation,6
221114,Solar Electric Power Generation,6
221115,Wind Electric Power Generation,6
221116,Geothermal Electric Power Generation,6
221117,Biomass Electric Power Generation,6
221118,Other Electric Power Generation,6
221121,Electric Bulk Power Transmission and Control,6
221122,Electric Power Distribution,6
221210,Natural Gas Distribution,6
221310,Water Supply and Irrigation Systems,6
221320,Sewage Treatment Facilities,6
221330,Steam and Air-Conditioning Supply,6
236115,New Single-Family Housing Construction (except For-Sale Builders),6
236116,New Multifamily Housing Construction (except For-Sale Builders),6
236117,New Housing For-Sale Builders,6
236118,Residential Remodelers,6
236210,Industrial Building Construction,6
236220,Commercial and Institutional Building Construction,6
237110,Water and Sewer Line and Related Structures Construction,6
237120,Oil and Gas Pipeline and Related Structures Construction,6
237130,Power and Communication Line and Related Structures Construction,6
237210,Land Subdivision,6
237310,"Highway, Street, and Bridge Construction",6
237990,Other Heavy and Civil Engineering Construction,6
238110,Poured Concrete Foundation and Structure Contractors,6
238120,Structural Steel and Precast Concrete Contractors,6
238130,Framing Contractors,6
238140,Masonry Contractors,6
238150,Glass and Glazing Contractors,6
238160,Roofing Contractors,6
238170,Siding Contractors,6
238190,"Other Foundation, Structure, and Building Exterior Contractors",6
238210,Electrical Contractors and Other Wiring Installation Contractors,6
238220,"Plumbing, Heating, and Air-Conditioning Contractors",6
238290,Other Building Equipment Contractors,6
238310,Drywall and Insulation Contractors,6
238320,Painting and Wall Covering Contractors,6
238330,Flooring Contractors,6
238340,Tile and Terrazzo Contractors,6
238350,Finish Carpentry Contractors,6
238390,Other Building Finishing Contractors,6
238910,Site Preparation Contractors,6
238990,All Other Specialty Trade Contractors,6
311111,Dog and Cat Food Manufacturing,6
311119,Other Animal Food Manufacturing,6
311211,Flour Milling,6
311212,Rice Milling,6
311213,Malt Manufacturing,6
311221,Wet Corn Milling and Starch Manufacturing,6
311224,Soybean and Other Oilseed Processing,6
311225,Fats and Oils Refining and Blending,6
311230,Breakfast Cereal Manufacturing,6
311313,Beet Sugar Manufacturing,6
311314,Cane Sugar Manufacturing,6
311340,Nonchocolate Confectionery Manufacturing,6
311351,Chocolate and Confectionery Manufacturing from Cacao Beans,6
311352,Confectionery Manufacturing from Purchased Chocolate,6
311411,"Frozen Fruit, Juice, and Vegetable Manufacturing",6
311412,Frozen Specialty Food Manufacturing,6
311421,Fruit and Vegetable Canning,6
311422,Specialty Canning,6
311423,Dried and Dehydrated Food Manufacturing,6
311511,Fluid Milk Manufacturing,6
311512,Creamery Butter Manufacturing,6
311513,Cheese Manufacturing,6
311514,"Dry, Condensed, and Evaporated Dairy Product Manufacturing",6
311520,Ice Cream and Frozen Dessert Manufacturing,6
311611,Animal (except Poultry) Slaughtering,6
311612,Meat Processed from Carcasses,6
311613,Rendering and Meat Byproduct Processing,6
311615,Poultry Processing,6
311710,Seafood Product Preparation and Packaging,6
311811,Retail Bakeries,6
311812,Commercial Bakeries,6
311813,"Frozen Cakes, Pies, and Other Pastries Manufacturing",6
311821,Cookie and Cracker Manufacturing,6
311824,"Dry Pasta, Dough, and Flour Mixes Manufacturing from Purchased Flour",6
311830,Tortilla Manufacturing,6
311911,Roasted Nuts and Peanut Butter Manufacturing,6
311919,Other Snack Food Manufacturing,6
311920,Coffee and Tea Manufacturing,6
311930,Flavoring Syrup and Concentrate Manufacturing,6
311941,"Mayonnaise, Dressing, and Other Prepared Sauce Manufacturing",6
311942,Spice and Extract Manufacturing,6
311991,Perishable Prepared Food Manufacturing,6
311999,All Other Miscellaneous Food Manufacturing,6
312111,Soft Drink Manufacturing,6
312112,Bottled Water Manufacturing,6
312113,Ice Manufacturing,6
312120,Breweries,6
312130,Wineries,6
312140,Distilleries,6
312230,Tobacco Manufacturing,6
313110,"Fiber, Yarn, and Thread Mills",6
313210,Broadwoven Fabric Mills,6
313220,Narrow Fabric Mills and Schiffli Machine Embroidery,6
313230,Nonwoven Fabric Mills,6
313240,Knit Fabric Mills,6
313310,Textile and Fabric Finishing Mills,6
313320,Fabric Coating Mills,6
314110,Carpet and Rug Mills,6
314120,Curtain and Linen Mills,6
314910,Textile Bag and Canvas Mills,6
314994,"Rope, Cordage, Twine, Tire Cord, and Tire Fabric Mills",6
314999,All Other Miscellaneous Textile Product Mills,6
315120,Apparel Knitting Mills,6
315210,Cut and Sew Apparel Contractors,6
315250,Cut and Sew Apparel Manufacturing (except Contractors),6
315990,Apparel Accessories and Other Apparel Manufacturing,6
316110,Leather and Hide Tanning and Finishing,6
316210,Footwear Manufacturing,6
316990,Other Leather and Allied Product Manufacturing,6
321113,Sawmills,6
321114,Wood Preservation,6
321211,Hardwood Veneer and Plywood Manufacturing,6
321212,Softwood Veneer and Plywood Manufacturing,6
321215,Engineered Wood Member Manufacturing,6
321219,Reconstituted Wood Product Manufacturing,6
321911,Wood Window and Door Manufacturing,6
321912,"Cut Stock, Resawing Lumber, and Planing",6
321918,Other Millwork (including Flooring),6
321920,Wood Container and Pallet Manufacturing,6
321991,Manufactured Home (Mobile Home) Manufacturing,6
321992,Prefabricated Wood Building Manufacturing,6
321999,All Other Miscellaneous Wood Product Manufacturing,6
322110,Pulp Mills,6
322120,Paper Mills,6
322130,Paperboard Mills,6
322211,Corrugated and Solid Fiber Box Manufacturing,6
322212,Folding Paperboard Box Manufacturing,6
322219,Other Paperboard Container Manufacturing,6
322220,Paper Bag and Coated and Treated Paper Manufacturing,6
322230,Stationery Product Manufacturing,6
322291,Sanitary Paper Product Manufacturing,6
322299,All Other Converted Paper Product Manufacturing,6
323111,Commercial Printing (except Screen and Books),6
323113,Commercial Screen Printing,6
323117,Books Printing,6
323120,Support Activities for Printing,6
324110,Petroleum Refineries,6
324121,Asphalt Paving Mixture and Block Manufacturing,6
324122,Asphalt Shingle and Coating Materials Manufacturing,6
324191,Petroleum Lubricating Oil and Grease Manufacturing,6
324199,All Other Petroleum and Coal Products Manufacturing,6
325110,Petrochemical Manufacturing,6
325120,Industrial Gas Manufacturing,6
325130,Synthetic Dye and Pigment Manufacturing,6
325180,Other Basic Inorganic Chemical Manufacturing,6
325193,Ethyl Alcohol Manufacturing,6
325194,"Cyclic Crude, Intermediate, and Gum and Wood Chemical Manufacturing",6
325199,All Other Basic Organic Chemical Manufacturing,6
325211,Plastics Material and Resin Manufacturing,6
325212,Synthetic Rubber Manufacturing,6
325220,Artificial and Synthetic Fibers and Filaments Manufacturing,6
325311,Nitrogenous Fertilizer Manufacturing,6
325312,Phosphatic Fertilizer Manufacturing,6
325314,Fertilizer (Mixing Only) Manufacturing,6
325315,Compost Manufacturing,6
325320,Pesticide and Other Agricultural Chemical Manufacturing,6
325411,Medicinal and Botanical Manufacturing,6
325412,Pharmaceutical Preparation Manufacturing,6
325413,In-Vitro Diagnostic Substance Manufacturing,6
325414,Biological Product (except Diagnostic) Manufacturing,6
325510,Paint and Coating Manufacturing,6
325520,Adhesive Manufacturing,6
325611,Soap and Other Detergent Manufacturing,6
325612,Polish and Other Sanitation Good Manufacturing,6
325613,Surface Active Agent Manufacturing,6
325620,Toilet Preparation Manufacturing,6
325910,Printing Ink Manufacturing,6
325920,Explosives Manufacturing,6
325991,Custom Compounding of Purchased Resins,6
325992,"Photographic Film, Paper, Plate, Chemical, and Copy Toner Manufacturing",6
325998,All Other Miscellaneous Chemical Product and Preparation Manufacturing,6
326111,Plastics Bag and Pouch Manufacturing,6
326112,Plastics Packaging Film and Sheet (including Laminated) Manufacturing,6
326113,Unlaminated Plastics Film and Sheet (except Packaging) Manufacturing,6
326121,Unlaminated Plastics Profile Shape Manufacturing,6
326122,Plastics Pipe and Pipe Fitting Manufacturing,6
326130,"Laminated Plastics Plate, Sheet (except Packaging), and Shape Manufacturing",6
326140,Polystyrene Foam Product Manufacturing,6
326150,Urethane and Other Foam Product (except Polystyrene) Manufacturing,6
326160,Plastics Bottle Manufacturing,6
326191,Plastics Plumbing Fixture Manufacturing,6
326199,All Other Plastics Product Manufacturing,6
326211,Tire Manufacturing (except Retreading),6
326212,Tire Retreading,6
326220,Rubber and Plastics Hoses and Belting Manufacturing,6
326291,Rubber Product Manufacturing for Mechanical Use,6
326299,All Other Rubber Product Manufacturing,6
327110,"Pottery, Ceramics, and Plumbing Fixture Manufacturing",6
327120,Clay Building Material and Refractories Manufacturing,6
327211,Flat Glass Manufacturing,6
327212,Other Pressed and Blown Glass and Glassware Manufacturing,6
327213,Glass Container Manufacturing,6
327215,Glass Product Manufacturing Made of Purchased Glass,6
327310,Cement Manufacturing,6
327320,Ready-Mix Concrete Manufacturing,6
327331,Concrete Block and Brick Manufacturing,6
327332,Concrete Pipe Manufacturing,6
327390,Other Concrete Product Manufacturing,6
327410,Lime Manufacturing,6
327420,Gypsum Product Manufacturing,6
327910,Abrasive Product Manufacturing,6
327991,Cut Stone and Stone Product Manufacturing,6
327992,Ground or Treated Mineral and Earth Manufacturing,6
327993,Mineral Wool Manufacturing,6
327999,All Other Miscellaneous Nonmetallic Mineral Product Manufacturing,6
331110,Iron and Steel Mills and Ferroalloy Manufacturing,6
331210,Iron and Steel Pipe and Tube Manufacturing from Purchased Steel,6
331221,Rolled Steel Shape Manufacturing,6
331222,Steel Wire Drawing,6
331313,Alumina Refining and Primary Aluminum Production,6
331314,Secondary Smelting and Alloying of Aluminum,6
331315,"Aluminum Sheet, Plate, and Foil Manufacturing",6
331318,"Other Aluminum Rolling, Drawing, and Extruding",6
331410,Nonferrous Metal (except Aluminum) Smelting and Refining,6
331420,"Copper Rolling, Drawing, Extruding, and Alloying",6
331491,"Nonferrous Metal (except Copper and Aluminum) Rolling, Drawing, and Extruding",6
331492,"Secondary Smelting, Refining, and Alloying of Nonferrous Metal (except Copper and Aluminum)",6
331511,Iron Foundries,6
331512,Steel Investment Foundries,6
331513,Steel Foundries (except Investment),6
331523,Nonferrous Metal Die-Casting Foundries,6
331524,Aluminum Foundries (except Die-Casting),6
331529,Other Nonferrous Metal Foundries (except Die-Casting),6
332111,Iron and Steel Forging,6
332112,Nonferrous Forging,6
332114,Custom Roll Forming,6
332117,Powder Metallurgy Part Manufacturing,6
332119,"Metal Crown, Closure, and Other Metal Stamping (except Automotive)",6
332215,"Metal Kitchen Cookware, Utensil, Cutlery, and Flatware (except Precious) Manufacturing",6
332216,Saw Blade and Handtool Manufacturing,6
332311,Prefabricated Metal Building and Component Manufacturing,6
332312,Fabricated Structural Metal Manufacturing,6
332313,Plate Work Manufacturing,6
332321,Metal Window and Door Manufacturing,6
332322,Sheet Metal Work Manufacturing,6
332323,Ornamental and Architectural Metal Work Manufacturing,6
332410,Power Boiler and Heat Exchanger Manufacturing,6
332420,Metal Tank (Heavy Gauge) Manufacturing,6
332431,Metal Can Manufacturing,6
332439,Other Metal Container Manufacturing,6
332510,Hardware Manufacturing,6
332613,Spring Manufacturing,6
332618,Other Fabricated Wire Product Manufacturing,6
332710,Machine Shops,6
332721,Precision Turned Product Manufacturing,6
332722,"Bolt, Nut, Screw, Rivet, and Washer Manufacturing",6
332811,Metal Heat Treating,6
332812,"Metal Coating, Engraving (except Jewelry and Silverware), and Allied Services to Manufacturers",6
332813,"Electroplating, Plating, Polishing, Anodizing, and Coloring",6
332911,Industrial Valve Manufacturing,6
332912,Fluid Power Valve and Hose Fitting Manufacturing,6
332913,Plumbing Fixture Fitting and Trim Manufacturing,6
332919,Other Metal Valve and Pipe Fitting Manufacturing,6
332991,Ball and Roller Bearing Manufacturing,6
332992,Small Arms Ammunition Manufacturing,6
332993,Ammunition (except Small Arms) Manufacturing,6
332994,"Small Arms, Ordnance, and Ordnance Accessories Manufacturing",6
332996,Fabricated Pipe and Pipe Fitting Manufacturing,6
332999,All Other Miscellaneous Fabricated Metal Product Manufacturing,6
333111,Farm Machinery and Equipment Manufacturing,6
333112,Lawn and Garden Tractor and Home Lawn and Garden Equipment Manufacturing,6
333120,Construction Machinery Manufacturing,6
333131,Mining Machinery and Equipment Manufacturing,6
333132,Oil and Gas Field Machinery and Equipment Manufacturing,6
333241,Food Product Machinery Manufacturing,6
333242,Semiconductor Machinery Manufacturing,6
333243,"Sawmill, Woodworking, and Paper Machinery Manufacturing",6
333248,All Other Industrial Machinery Manufacturing,6
333310,Commercial and Service Industry Machinery Manufacturing,6
333413,Industrial and Commercial Fan and Blower and Air Purification Equipment Manufacturing,6
333414,Heating Equipment (except Warm Air Furnaces) Manufacturing,6
333415,Air-Conditioning and Warm Air Heating Equipment and Commercial and Industrial Refrigeration Equipment Manufacturing,6
333511,Industrial Mold Manufacturing,6
333514,"Special Die and Tool, Die Set, Jig, and Fixture Manufacturing",6
333515,Cutting Tool and Machine Tool Accessory Manufacturing,6
333517,Machine Tool Manufacturing,6
333519,Rolling Mill and Other Metalworking Machinery Manufacturing,6
333611,Turbine and Turbine Generator Set Units Manufacturing,6
333612,"Speed Changer, Industrial High-Speed Drive, and Gear Manufacturing",6
333613,Mechanical Power Transmission Equipment Manufacturing,6
333618,Other Engine Equipment Manufacturing,6
333912,Air and Gas Compressor Manufacturing,6
333914,"Measuring, Dispensing, and Other Pumping Equipment Manufacturing",6
333921,Elevator and Moving Stairway Manufacturing,6
333922,Conveyor and Conveying Equipment Manufacturing,6
333923,"Overhead Traveling Crane, Hoist, and Monorail System Manufacturing",6
333924,"Industrial Truck, Tractor, Trailer, and Stacker Machinery Manufacturing",6
333991,Power-Driven Handtool Manufacturing,6
333992,Welding and Soldering Equipment Manufacturing,6
333993,Packaging Machinery Manufacturing,6
333994,Industrial Process Furnace and Oven Manufacturing,6
333995,Fluid Power Cylinder and Actuator Manufacturing,6
333996,Fluid Power Pump and Motor Manufacturing,6
333998,All Other Miscellaneous General Purpose Machinery Manufacturing,6
334111,Electronic Computer Manufacturing,6
334112,Computer Storage Device Manufacturing,6
334118,Computer Terminal and Other Computer Peripheral Equipment Manufacturing,6
334210,Telephone Apparatus Manufacturing,6
334220,Radio and Television Broadcasting and Wireless Communications Equipment Manufacturing,6
334290,Other Communications Equipment Manufacturing,6
334310,Audio and Video Equipment Manufacturing,6
334412,Bare Printed Circuit Board Manufacturing,6
334413,Semiconductor and Related Device Manufacturing,6
334416,"Capacitor, Resistor, Coil, Transformer, and Other Inductor Manufacturing",6
334417,Electronic Connector Manufacturing,6
334418,Printed Circuit Assembly (Electronic Assembly) Manufacturing,6
334419,Other Electronic Component Manufacturing,6
334510,Electromedical and Electrotherapeutic Apparatus Manufacturing,6
334511,"Search, Detection, Navigation, Guidance, Aeronautical, and Nautical System and Instrument Manufacturing",6
334512,"Automatic Environmental Control Manufacturing for Residential, Commercial, and Appliance Use",6
334513,"Instruments and Related Products Manufacturing for Measuring, Displaying, and Controlling Industrial Process Variables",6
334514,Totalizing Fluid Meter and Counting Device Manufacturing,6
334515,Instrument Manufacturing for Measuring and Testing Electricity and Electrical Signals,6
334516,Analytical Laboratory Instrument Manufacturing,6
334517,Irradiation Apparatus Manufacturing,6
334519,Other Measuring and Controlling Device Manufacturing,6
334610,Manufacturing and Reproducing Magnetic and Optical Media,6
335131,Residential Electric Lighting Fixture Manufacturing,6
335132,"Commercial, Industrial, and Institutional Electric Lighting Fixture Manufacturing",6
335139,Electric Lamp Bulb and Other Lighting Equipment Manufacturing,6
335210,Small Electrical Appliance Manufacturing,6
335220,Major Household Appliance Manufacturing,6
335311,"Power, Distribution, and Specialty Transformer Manufacturing",6
335312,Motor and Generator Manufacturing,6
335313,Switchgear and Switchboard Apparatus Manufacturing,6
335314,Relay and Industrial Control Manufacturing,6
335910,Battery Manufacturing,6
335921,Fiber Optic Cable Manufacturing,6
335929,Other Communication and Energy Wire Manufacturing,6
335931,Current-Carrying Wiring Device Manufacturing,6
335932,Noncurrent-Carrying Wiring Device Manufacturing,6
335991,Carbon and Graphite Product Manufacturing,6
335999,All Other Miscellaneous Electrical Equipment and Component Manufacturing,6
336110,Automobile and Light Duty Motor Vehicle Manufacturing,6
336120,Heavy Duty Truck Manufacturing,6
336211,Motor Vehicle Body Manufacturing,6
336212,Truck Trailer Manufacturing,6
336213,Motor Home Manufacturing,6
336214,Travel Trailer and Camper Manufacturing,6
336310,Motor Vehicle Gasoline Engine and Engine Parts Manufacturing,6
336320,Motor Vehicle Electrical and Electronic Equipment Manufacturing,6
336330,Motor Vehicle Steering and Suspension Components (except Spring) Manufacturing,6
336340,Motor Vehicle Brake System Manufacturing,6
336350,Motor Vehicle Transmission and Power Train Parts Manufacturing,6
336360,Motor Vehicle Seating and Interior Trim Manufacturing,6
336370,Motor Vehicle Metal Stamping,6
336390,Other Motor Vehicle Parts Manufacturing,6
336411,Aircraft Manufacturing,6
336412,Aircraft Engine and Engine Parts Manufacturing,6
336413,Other Aircraft Parts and Auxiliary Equipment Manufacturing,6
336414,Guided Missile and Space Vehicle Manufacturing,6
336415,Guided Missile and Space Vehicle Propulsion Unit and Propulsion Unit Parts Manufacturing,6
336419,Other Guided Missile and Space Vehicle Parts and Auxiliary Equipment Manufacturing,6
336510,Railroad Rolling Stock Manufacturing,6
336611,Ship Building and Repairing,6
336612,Boat Building,6
336991,"Motorcycle, Bicycle, and Parts Manufacturing",6
336992,"Military Armored Vehicle, Tank, and Tank Component Manufacturing",6
336999,All Other Transportation Equipment Manufacturing,6
337110,Wood Kitchen Cabinet and Countertop Manufacturing,6
337121,Upholstered Household Furniture Manufacturing,6
337122,Nonupholstered Wood Household Furniture Manufacturing,6
337126,Household Furniture (except Wood and Upholstered) Manufacturing,6
337127,Institutional Furniture Manufacturing,6
337211,Wood Office Furniture Manufacturing,6
337212,Custom Architectural Woodwork and Millwork Manufacturing,6
337214,Office Furniture (except Wood) Manufacturing,6
337215,"Showcase, Partition, Shelving, and Locker Manufacturing",6
337910,Mattress Manufacturing,6
337920,Blind and Shade Manufacturing,6
339112,Surgical and Medical Instrument Manufacturing,6
339113,Surgical Appliance and Supplies Manufacturing,6
339114,Dental Equipment and Supplies Manufacturing,6
339115,Ophthalmic Goods Manufacturing,6
339116,Dental Laboratories,6
339910,Jewelry and Silverware Manufacturing,6
339920,Sporting and Athletic Goods Manufacturing,6
339930,"Doll, Toy, and Game Manufacturing",6
339940,Office Supplies (except Paper) Manufacturing,6
339950,Sign Manufacturing,6
339991,"Gasket, Packing, and Sealing Device Manufacturing",6
339992,Musical Instrument Manufacturing,6
339993,"Fastener, Button, Needle, and Pin Manufacturing",6
339994,"Broom, Brush, and Mop Manufacturing",6
339995,Burial Casket Manufacturing,6
339999,All Other Miscellaneous Manufacturing,6
423110,Automobile and Other Motor Vehicle Merchant Wholesalers,6
423120,Motor Vehicle Supplies and New Parts Merchant Wholesalers,6
423130,Tire and Tube Merchant Wholesalers,6
423140,Motor Vehicle Parts (Used) Merchant Wholesalers,6
423210,Furniture Merchant Wholesalers,6
423220,Home Furnishing Merchant Wholesalers,6
423310,"Lumber, Plywood, Millwork, and Wood Panel Merchant Wholesalers",6
423320,"Brick, Stone, and Related Construction Material Merchant Wholesalers",6
423330,"Roofing, Siding, and Insulation Material Merchant Wholesalers",6
423390,Other Construction Material Merchant Wholesalers,6
423410,Photographic Equipment and Supplies Merchant Wholesalers,6
423420,Office Equipment Merchant Wholesalers,6
423430,Computer and Computer Peripheral Equipment and Software Merchant Wholesalers,6
423440,Other Commercial Equipment Merchant Wholesalers,6
423450,"Medical, Dental, and Hospital Equipment and Supplies Merchant Wholesalers",6
423460,Ophthalmic Goods Merchant Wholesalers,6
423490,Other Professional Equipment and Supplies Merchant Wholesalers,6
423510,Metal Service Centers and Other Metal Merchant Wholesalers,6
423520,Coal and Other Mineral and Ore Merchant Wholesalers,6
423610,"Electrical Apparatus and Equipment, Wiring Supplies, and Related Equipment Merchant Wholesalers",6
423620,"Household Appliances, Electric Housewares, and Consumer Electronics Merchant Wholesalers",6
423690,Other Electronic Parts and Equipment Merchant Wholesalers,6
423710,Hardware Merchant Wholesalers,6
423720,Plumbing and Heating Equipment and Supplies (Hydronics) Merchant Wholesalers,6
423730,Warm Air Heating and Air-Conditioning Equipment and Supplies Merchant Wholesalers,6
423740,Refrigeration Equipment and Supplies Merchant Wholesalers,6
423810,Construction and Mining (except Oil Well) Machinery and Equipment Merchant Wholesalers,6
423820,Farm and Garden Machinery and Equipment Merchant Wholesalers,6
423830,Industrial Machinery and Equipment Merchant Wholesalers,6
423840,Industrial Supplies Merchant Wholesalers,6
423850,Service Establishment Equipment and Supplies Merchant Wholesalers,6
423860,Transportation Equipment and Supplies (except Motor Vehicle) Merchant Wholesalers,6
