code,title
62221,Psychiatric and Substance Abuse Hospitals
62231,Specialty (except Psychiatric and Substance Abuse) Hospitals
62311,Nursing Care Facilities (Skilled Nursing Facilities)
62321,Residential Intellectual and Developmental Disability Facilities
62322,Residential Mental Health and Substance Abuse Facilities
62331,Continuing Care Retirement Communities and Assisted Living Facilities for the Elderly
62399,Other Residential Care Facilities
62411,Child and Youth Services
62412,Services for the Elderly and Persons with Disabilities
62419,Other Individual and Family Services
62421,Community Food Services
62422,Community Housing Services
62423,Emergency and Other Relief Services
62431,Vocational Rehabilitation Services
62441,Child Care Services
71111,Theater Companies and Dinner Theaters
71112,Dance Companies
71113,Musical Groups and Artists
71119,Other Performing Arts Companies
71121,Spectator Sports
71131,"Promoters of Performing Arts, Sports, and Similar Events with Facilities"
71132,"Promoters of Performing Arts, Sports, and Similar Events without Facilities"
71141,"Agents and Managers for Artists, Athletes, Entertainers, and Other Public Figures"
71151,"Independent Artists, Writers, and Performers"
71211,Museums
71212,Historical Sites
71213,Zoos and Botanical Gardens
71219,Nature Parks and Other Similar Institutions
71311,Amusement and Theme Parks
71312,Amusement Arcades
71321,Casinos (except Casino Hotels)
71329,Other Gambling Industries
71391,Golf Courses and Country Clubs
71392,Skiing Facilities
71393,Marinas
71394,Fitness and Recreational Sports Centers
71395,Bowling Centers
71399,All Other Amusement and Recreation Industries
72111,Hotels (except Casino Hotels) and Motels
72112,Casino Hotels
72119,Other Traveler Accommodation
72121,RV (Recreational Vehicle) Parks and Recreational Camps
72131,"Rooming and Boarding Houses, Dormitories, and Workers' Camps"
72231,Food Service Contractors
72232,Caterers
72233,Mobile Food Services
72241,Drinking Places (Alcoholic Beverages)
72251,Restaurants and Other Eating Places
81111,Automotive Mechanical and Electrical Repair and Maintenance
81112,"Automotive Body, Paint, Interior, and Glass Repair"
81119,Other Automotive Repair and Maintenance
81121,Electronic and Precision Equipment Repair and Maintenance
81131,Commercial and Industrial Machinery and Equipment (except Automotive and Electronic) Repair and Maintenance
81141,Home and Garden Equipment and Appliance Repair and Maintenance
81142,Reupholstery and Furniture Repair
81143,Footwear and Leather Goods Repair
81149,Other Personal and Household Goods Repair and Maintenance
81211,"Hair, Nail, and Skin Care Services"
81219,Other Personal Care Services
81221,Funeral Homes and Funeral Services
81222,Cemeteries and Crematories
81231,Coin-Operated Laundries and Drycleaners
81232,Drycleaning and Laundry Services (except Coin-Operated)
81233,Linen and Uniform Supply
81291,Pet Care (except Veterinary) Services
81292,Photofinishing
81293,Parking Lots and Garages
81299,All Other Personal Services
81311,Religious Organizations
81321,Grantmaking and Giving Services
81331,Social Advocacy Organizations
81341,Civic and Social Organizations
81391,Business Associations
81392,Professional Organizations
81393,Labor Unions and Similar Labor Organizations
81394,Political Organizations
81399,"Other Similar Organizations (except Business, Professional, Labor, and Political Organizations)"
81411,Private Households
92111,Executive Offices
92112,Legislative Bodies
92113,Public Finance Activities
92114,"Executive and Legislative Offices, Combined"
92115,American Indian and Alaska Native Tribal Governments
92119,Other General Government Support
92211,Courts
92212,Police Protection
92213,Legal Counsel and Prosecution
92214,Correctional Institutions
92215,Parole Offices and Probation Offices
92216,Fire Protection
92219,"Other Justice, Public Order, and Safety Activities"
92311,Administration of Education Programs
92312,Administration of Public Health Programs
92313,"Administration of Human Resource Programs (except Education, Public Health, and Veterans' Affairs Programs)"
92314,Administration of Veterans' Affairs
92411,Administration of Air and Water Resource and Solid Waste Management Programs
92412,Administration of Conservation Programs
92511,Administration of Housing Programs
92512,Administration of Urban Planning and Community and Rural Development
92611,Administration of General Economic Programs
92612,Regulation and Administration of Transportation Programs
92613,"Regulation and Administration of Communications, Electric, Gas, and Other Utilities"
92614,Regulation of Agricultural Marketing and Commodities
92615,"Regulation, Licensing, and Inspection of Miscellaneous Commercial Sectors"
92711,Space Research and Technology
92811,National Security
92812,International Affairs
