code,title
11111,Soybean Farming
11112,Oilseed (except Soybean) Farming
11113,Dry Pea and Bean Farming
11114,Wheat Farming
11115,Corn Farming
11116,Rice Farming
11119,Other Grain Farming
11121,Vegetable and Melon Farming
11131,Orange Groves
11132,Citrus (except Orange) Groves
11133,Noncitrus Fruit and Tree Nut Farming
11141,Food Crops Grown Under Cover
11142,Nursery and Floriculture Production
11191,Tobacco Farming
11192,Cotton Farming
11193,Sugarcane Farming
11194,Hay Farming
11199,All Other Crop Farming
11211,"Beef Cattle Ranching and Farming, including Feedlots"
11212,Dairy Cattle and Milk Production
11213,Dual-Purpose Cattle Ranching and Farming
11221,Hog and Pig Farming
11231,Chicken Egg Production
11232,Broilers and Other Meat Type Chicken Production
11233,Turkey Production
11234,Poultry Hatcheries
11239,Other Poultry Production
11241,Sheep Farming
11242,Goat Farming
11251,Aquaculture
11291,Apiculture
11292,Horses and Other Equine Production
11293,Fur-Bearing Animal and Rabbit Production
11299,All Other Animal Production
11311,Timber Tract Operations
11321,Forest Nurseries and Gathering of Forest Products
11331,Logging
11411,Fishing
11421,Hunting and Trapping
11511,Support Activities for Crop Production
11521,Support Activities for Animal Production
11531,Support Activities for Forestry
21112,Crude Petroleum Extraction
21113,Natural Gas Extraction
21211,Coal Mining
21221,Iron Ore Mining
21222,Gold Ore and Silver Ore Mining
21223,"Copper, Nickel, Lead, and Zinc Mining"
21229,Other Metal Ore Mining
21231,Stone Mining and Quarrying
21232,"Sand, Gravel, Clay, and Ceramic and Refractory Minerals Mining and Quarrying"
21239,Other Nonmetallic Mineral Mining and Quarrying
21311,Support Activities for Mining
22111,Electric Power Generation
22112,"Electric Power Transmission, Control, and Distribution"
22121,Natural Gas Distribution
22131,Water Supply and Irrigation Systems
22132,Sewage Treatment Facilities
22133,Steam and Air-Conditioning Supply
23611,Residential Building Construction
23621,Industrial Building Construction
23622,Commercial and Institutional Building Construction
23711,Water and Sewer Line and Related Structures Construction
23712,Oil and Gas Pipeline and Related Structures Construction
23713,Power and Communication Line and Related Structures Construction
23721,Land Subdivision
23731,"Highway, Street, and Bridge Construction"
23799,Other Heavy and Civil Engineering Construction
23811,Poured Concrete Foundation and Structure Contractors
23812,Structural Steel and Precast Concrete Contractors
23813,Framing Contractors
23814,Masonry Contractors
23815,Glass and Glazing Contractors
23816,Roofing Contractors
23817,Siding Contractors
23819,"Other Foundation, Structure, and Building Exterior Contractors"
23821,Electrical Contractors and Other Wiring Installation Contractors
23822,"Plumbing, Heating, and Air-Conditioning Contractors"
23829,Other Building Equipment Contractors
23831,Drywall and Insulation Contractors
23832,Painting and Wall Covering Contractors
23833,Flooring Contractors
23834,Tile and Terrazzo Contractors
23835,Finish Carpentry Contractors
23839,Other Building Finishing Contractors
23891,Site Preparation Contractors
23899,All Other Specialty Trade Contractors
31111,Animal Food Manufacturing
31121,Flour Milling and Malt Manufacturing
31122,Starch and Vegetable Fats and Oils Manufacturing
31123,Breakfast Cereal Manufacturing
31131,Sugar Manufacturing
31134,Nonchocolate Confectionery Manufacturing
31135,Chocolate and Confectionery Manufacturing
31141,Frozen Food Manufacturing
31142,"Fruit and Vegetable Canning, Pickling, and Drying"
31151,Dairy Product (except Frozen) Manufacturing
31152,Ice Cream and Frozen Dessert Manufacturing
31161,Animal Slaughtering and Processing
31171,Seafood Product Preparation and Packaging
31181,Bread and Bakery Product Manufacturing
31182,"Cookie, Cracker, and Pasta Manufacturing"
31183,Tortilla Manufacturing
31191,Snack Food Manufacturing
31192,Coffee and Tea Manufacturing
31193,Flavoring Syrup and Concentrate Manufacturing
31194,Seasoning and Dressing Manufacturing
31199,All Other Food Manufacturing
31211,Soft Drink and Ice Manufacturing
31212,Breweries
31213,Wineries
31214,Distilleries
31223,Tobacco Manufacturing
31311,"Fiber, Yarn, and Thread Mills"
31321,Broadwoven Fabric Mills
31322,Narrow Fabric Mills and Schiffli Machine Embroidery
31323,Nonwoven Fabric Mills
31324,Knit Fabric Mills
31331,Textile and Fabric Finishing Mills
31332,Fabric Coating Mills
31411,Carpet and Rug Mills
31412,Curtain and Linen Mills
31491,Textile Bag and Canvas Mills
31499,All Other Textile Product Mills
31512,Apparel Knitting Mills
31521,Cut and Sew Apparel Contractors
31525,Cut and Sew Apparel Manufacturing (except Contractors)
31599,Apparel Accessories and Other Apparel Manufacturing
31611,Leather and Hide Tanning and Finishing
31621,Footwear Manufacturing
31699,Other Leather and Allied Product Manufacturing
32111,Sawmills and Wood Preservation
32121,"Veneer, Plywood, and Engineered Wood Product Manufacturing"
32191,Millwork
32192,Wood Container and Pallet Manufacturing
32199,All Other Wood Product Manufacturing
32211,Pulp Mills
32212,Paper Mills
32213,Paperboard Mills
32221,Paperboard Container Manufacturing
32222,Paper Bag and Coated and Treated Paper Manufacturing
32223,Stationery Product Manufacturing
32229,Other Converted Paper Product Manufacturing
32311,Printing
32312,Support Activities for Printing
32411,Petroleum Refineries
32412,"Asphalt Paving, Roofing, and Saturated Materials Manufacturing"
32419,Other Petroleum and Coal Products Manufacturing
32511,Petrochemical Manufacturing
32512,Industrial Gas Manufacturing
32513,Synthetic Dye and Pigment Manufacturing
32518,Other Basic Inorganic Chemical Manufacturing
32519,Other Basic Organic Chemical Manufacturing
32521,Resin and Synthetic Rubber Manufacturing
32522,Artificial and Synthetic Fibers and Filaments Manufacturing
32531,Fertilizer and Compost Manufacturing
32532,Pesticide and Other Agricultural Chemical Manufacturing
32541,Pharmaceutical and Medicine Manufacturing
32551,Paint and Coating Manufacturing
32552,Adhesive Manufacturing
32561,Soap and Cleaning Compound Manufacturing
32562,Toilet Preparation Manufacturing
32591,Printing Ink Manufacturing
32592,Explosives Manufacturing
32599,All Other Chemical Product and Preparation Manufacturing
32611,Plastics Packaging Materials and Unlaminated Film and Sheet Manufacturing
32612,"Plastics Pipe, Pipe Fitting, and Unlaminated Profile Shape Manufacturing"
32613,"Laminated Plastics Plate, Sheet (except Packaging), and Shape Manufacturing"
32614,Polystyrene Foam Product Manufacturing
32615,Urethane and Other Foam Product (except Polystyrene) Manufacturing
32616,Plastics Bottle Manufacturing
32619,Other Plastics Product Manufacturing
32621,Tire Manufacturing
32622,Rubber and Plastics Hoses and Belting Manufacturing
32629,Other Rubber Product Manufacturing
32711,"Pottery, Ceramics, and Plumbing Fixture Manufacturing"
32712,Clay Building Material and Refractories Manufacturing
32721,Glass and Glass Product Manufacturing
32731,Cement Manufacturing
32732,Ready-Mix Concrete Manufacturing
32733,"Concrete Pipe, Brick, and Block Manufacturing"
32739,Other Concrete Product Manufacturing
32741,Lime Manufacturing
32742,Gypsum Product Manufacturing
32791,Abrasive Product Manufacturing
32799,All Other Nonmetallic Mineral Product Manufacturing
33111,Iron and Steel Mills and Ferroalloy Manufacturing
33121,Iron and Steel Pipe and Tube Manufacturing from Purchased Steel
33122,Rolling and Drawing of Purchased Steel
33131,Alumina and Aluminum Production and Processing
33141,Nonferrous Metal (except Aluminum) Smelting and Refining
33142,"Copper Rolling, Drawing, Extruding, and Alloying"
33149,"Nonferrous Metal (except Copper and Aluminum) Rolling, Drawing, Extruding, and Alloying"
33151,Ferrous Metal Foundries
33152,Nonferrous Metal Foundries
33211,Forging and Stamping
33221,Cutlery and Handtool Manufacturing
33231,Plate Work and Fabricated Structural Product Manufacturing
33232,Ornamental and Architectural Metal Products Manufacturing
33241,Power Boiler and Heat Exchanger Manufacturing
33242,Metal Tank (Heavy Gauge) Manufacturing
33243,"Metal Can, Box, and Other Metal Container (Light Gauge) Manufacturing"
33251,Hardware Manufacturing
33261,Spring and Wire Product Manufacturing
33271,Machine Shops
33272,"Turned Product and Screw, Nut, and Bolt Manufacturing"
33281,"Coating, Engraving, Heat Treating, and Allied Activities"
33291,Metal Valve Manufacturing
33299,All Other Fabricated Metal Product Manufacturing
33311,Agricultural Implement Manufacturing
33312,Construction Machinery Manufacturing
33313,Mining and Oil and Gas Field Machinery Manufacturing
33324,Industrial Machinery Manufacturing
33331,Commercial and Service Industry Machinery Manufacturing
33341,"Ventilation, Heating, Air-Conditioning, and Commercial Refrigeration Equipment Manufacturing"
33351,Metalworking Machinery Manufacturing
33361,"Engine, Turbine, and Power Transmission Equipment Manufacturing"
33391,Pump and Compressor Manufacturing
33392,Material Handling Equipment Manufacturing
33399,All Other General Purpose Machinery Manufacturing
33411,Computer and Peripheral Equipment Manufacturing
33421,Telephone Apparatus Manufacturing
33422,Radio and Television Broadcasting and Wireless Communications Equipment Manufacturing
33429,Other Communications Equipment Manufacturing
33431,Audio and Video Equipment Manufacturing
33441,Semiconductor and Other Electronic Component Manufacturing
33451,"Navigational, Measuring, Electromedical, and Control Instruments Manufacturing"
33461,Manufacturing and Reproducing Magnetic and Optical Media
33513,Electric Lighting Equipment Manufacturing
33521,Small Electrical Appliance Manufacturing
33522,Major Household Appliance Manufacturing
33531,Electrical Equipment Manufacturing
33591,Battery Manufacturing
33592,Communication and Energy Wire and Cable Manufacturing
33593,Wiring Device Manufacturing
33599,All Other Electrical Equipment and Component Manufacturing
33611,Automobile and Light Duty Motor Vehicle Manufacturing
33612,Heavy Duty Truck Manufacturing
33621,Motor Vehicle Body and Trailer Manufacturing
33631,Motor Vehicle Gasoline Engine and Engine Parts Manufacturing
33632,Motor Vehicle Electrical and Electronic Equipment Manufacturing
33633,Motor Vehicle Steering and Suspension Components (except Spring) Manufacturing
33634,Motor Vehicle Brake System Manufacturing
33635,Motor Vehicle Transmission and Power Train Parts Manufacturing
33636,Motor Vehicle Seating and Interior Trim Manufacturing
33637,Motor Vehicle Metal Stamping
33639,Other Motor Vehicle Parts Manufacturing
33641,Aerospace Product and Parts Manufacturing
33651,Railroad Rolling Stock Manufacturing
33661,Ship and Boat Building
33699,Other Transportation Equipment Manufacturing
33711,Wood Kitchen Cabinet and Countertop Manufacturing
33712,Household and Institutional Furniture Manufacturing
33721,Office Furniture (including Fixtures) Manufacturing
33791,Mattress Manufacturing
33792,Blind and Shade Manufacturing
33911,Medical Equipment and Supplies Manufacturing
33991,Jewelry and Silverware Manufacturing
33992,Sporting and Athletic Goods Manufacturing
33993,"Doll, Toy, and Game Manufacturing"
33994,Office Supplies (except Paper) Manufacturing
33995,Sign Manufacturing
33999,All Other Miscellaneous Manufacturing
42311,Automobile and Other Motor Vehicle Merchant Wholesalers
42312,Motor Vehicle Supplies and New Parts Merchant Wholesalers
42313,Tire and Tube Merchant Wholesalers
42314,Motor Vehicle Parts (Used) Merchant Wholesalers
42321,Furniture Merchant Wholesalers
42322,Home Furnishing Merchant Wholesalers
42331,"Lumber, Plywood, Millwork, and Wood Panel Merchant Wholesalers"
42332,"Brick, Stone, and Related Construction Material Merchant Wholesalers"
42333,"Roofing, Siding, and Insulation Material Merchant Wholesalers"
42339,Other Construction Material Merchant Wholesalers
42341,Photographic Equipment and Supplies Merchant Wholesalers
42342,Office Equipment Merchant Wholesalers
42343,Computer and Computer Peripheral Equipment and Software Merchant Wholesalers
42344,Other Commercial Equipment Merchant Wholesalers
42345,"Medical, Dental, and Hospital Equipment and Supplies Merchant Wholesalers"
42346,Ophthalmic Goods Merchant Wholesalers
42349,Other Professional Equipment and Supplies Merchant Wholesalers
42351,Metal Service Centers and Other Metal Merchant Wholesalers
42352,Coal and Other Mineral and Ore Merchant Wholesalers
42361,"Electrical Apparatus and Equipment, Wiring Supplies, and Related Equipment Merchant Wholesalers"
42362,"Household Appliances, Electric Housewares, and Consumer Electronics Merchant Wholesalers"
42369,Other Electronic Parts and Equipment Merchant Wholesalers
42371,Hardware Merchant Wholesalers
42372,Plumbing and Heating Equipment and Supplies (Hydronics) Merchant Wholesalers
42373,Warm Air Heating and Air-Conditioning Equipment and Supplies Merchant Wholesalers
42374,Refrigeration Equipment and Supplies Merchant Wholesalers
42381,Construction and Mining (except Oil Well) Machinery and Equipment Merchant Wholesalers
42382,Farm and Garden Machinery and Equipment Merchant Wholesalers
42383,Industrial Machinery and Equipment Merchant Wholesalers
42384,Industrial Supplies Merchant Wholesalers
42385,Service Establishment Equipment and Supplies Merchant Wholesalers
42386,Transportation Equipment and Supplies (except Motor Vehicle) Merchant Wholesalers
42391,Sporting and Recreational Goods and Supplies Merchant Wholesalers
42392,Toy and Hobby Goods and Supplies Merchant Wholesalers
42393,Recyclable Material Merchant Wholesalers
42394,"Jewelry, Watch, Precious Stone, and Precious Metal Merchant Wholesalers"
42399,Other Miscellaneous Durable Goods Merchant Wholesalers
42411,Printing and Writing Paper Merchant Wholesalers
42412,Stationery and Office Supplies Merchant Wholesalers
42413,Industrial and Personal Service Paper Merchant Wholesalers
42421,Drugs and Druggists' Sundries Merchant Wholesalers
42431,"Piece Goods, Notions, and Other Dry Goods Merchant Wholesalers"
42434,Footwear Merchant Wholesalers
42435,Clothing and Clothing Accessories Merchant Wholesalers
42441,General Line Grocery Merchant Wholesalers
42442,Packaged Frozen Food Merchant Wholesalers
42443,Dairy Product (except Dried or Canned) Merchant Wholesalers
42444,Poultry and Poultry Product Merchant Wholesalers
42445,Confectionery Merchant Wholesalers
42446,Fish and Seafood Merchant Wholesalers
42447,Meat and Meat Product Merchant Wholesalers
42448,Fresh Fruit and Vegetable Merchant Wholesalers
42449,Other Grocery and Related Products Merchant Wholesalers
42451,Grain and Field Bean Merchant Wholesalers
42452,Livestock Merchant Wholesalers
42459,Other Farm Product Raw Material Merchant Wholesalers
42461,Plastics Materials and Basic Forms and Shapes Merchant Wholesalers
42469,Other Chemical and Allied Products Merchant Wholesalers
42471,Petroleum Bulk Stations and Terminals
42472,Petroleum and Petroleum Products Merchant Wholesalers (except Bulk Stations and Terminals)
42481,Beer and Ale Merchant Wholesalers
42482,Wine and Distilled Alcoholic Beverage Merchant Wholesalers
42491,Farm Supplies Merchant Wholesalers
42492,"Book, Periodical, and Newspaper Merchant Wholesalers"
42493,"Flower, Nursery Stock, and Florists' Supplies Merchant Wholesalers"
42494,Tobacco Product and Electronic Cigarette Merchant Wholesalers
42495,"Paint, Varnish, and Supplies Merchant Wholesalers"
42499,Other Miscellaneous Nondurable Goods Merchant Wholesalers
42512,Wholesale Trade Agents and Brokers
44111,New Car Dealers
44112,Used Car Dealers
44121,Recreational Vehicle Dealers
44122,"Motorcycle, Boat, and Other Motor Vehicle Dealers"
44133,Automotive Parts and Accessories Retailers
44134,Tire Dealers
44411,Home Centers
44412,Paint and Wallpaper Retailers
44414,Hardware Retailers
44418,Other Building Material Dealers
44423,Outdoor Power Equipment Retailers
44424,"Nursery, Garden Center, and Farm Supply Retailers"
44511,Supermarkets and Other Grocery Retailers (except Convenience Retailers)
44513,Convenience Retailers and Vending Machine Operators
44523,Fruit and Vegetable Retailers
44524,Meat Retailers
44525,Fish and Seafood Retailers
44529,Other Specialty Food Retailers
44532,"Beer, Wine, and Liquor Retailers"
44911,Furniture Retailers
44912,Home Furnishings Retailers
44921,Electronics and Appliance Retailers
45511,Department Stores
45521,"Warehouse Clubs, Supercenters, and Other General Merchandise Retailers"
45611,Pharmacies and Drug Retailers
45612,"Cosmetics, Beauty Supplies, and Perfume Retailers"
45613,Optical Goods Retailers
45619,Other Health and Personal Care Retailers
45711,Gasoline Stations with Convenience Stores
45712,Other Gasoline Stations
45721,Fuel Dealers
45811,Clothing and Clothing Accessories Retailers
45821,Shoe Retailers
45831,Jewelry Retailers
45832,Luggage and Leather Goods Retailers
45911,Sporting Goods Retailers
45912,"Hobby, Toy, and Game Retailers"
45913,"Sewing, Needlework, and Piece Goods Retailers"
45914,Musical Instrument and Supplies Retailers
45921,Book Retailers and News Dealers
45931,Florists
45941,Office Supplies and Stationery Retailers
45942,"Gift, Novelty, and Souvenir Retailers"
45951,Used Merchandise Retailers
45991,Pet and Pet Supplies Retailers
45992,Art Dealers
45993,Manufactured (Mobile) Home Dealers
45999,All Other Miscellaneous Retailers
48111,Scheduled Air Transportation
48121,Nonscheduled Air Transportation
48211,Rail Transportation
48311,"Deep Sea, Coastal, and Great Lakes Water Transportation"
48321,Inland Water Transportation
48411,"General Freight Trucking, Local"
48412,"General Freight Trucking, Long-Distance"
48421,Used Household and Office Goods Moving
48422,"Specialized Freight (except Used Goods) Trucking, Local"
48423,"Specialized Freight (except Used Goods) Trucking, Long-Distance"
48511,Urban Transit Systems
48521,Interurban and Rural Bus Transportation
48531,Taxi and Ridesharing Services
48532,Limousine Service
48541,School and Employee Bus Transportation
48551,Charter Bus Industry
48599,Other Transit and Ground Passenger Transportation
48611,Pipeline Transportation of Crude Oil
48621,Pipeline Transportation of Natural Gas
48691,Pipeline Transportation of Refined Petroleum Products
48699,All Other Pipeline Transportation
48711,"Scenic and Sightseeing Transportation, Land"
48721,"Scenic and Sightseeing Transportation, Water"
48799,"Scenic and Sightseeing Transportation, Other"
48811,Airport Operations
48819,Other Support Activities for Air Transportation
48821,Support Activities for Rail Transportation
48831,Port and Harbor Operations
48832,Marine Cargo Handling
48833,Navigational Services to Shipping
48839,Other Support Activities for Water Transportation
48841,Motor Vehicle Towing
48849,Other Support Activities for Road Transportation
48851,Freight Transportation Arrangement
48899,Other Support Activities for Transportation
49111,Postal Service
49211,Couriers and Express Delivery Services
49221,Local Messengers and Local Delivery
49311,General Warehousing and Storage
49312,Refrigerated Warehousing and Storage
49313,Farm Product Warehousing and Storage
49319,Other Warehousing and Storage
51211,Motion Picture and Video Production
51212,Motion Picture and Video Distribution
51213,Motion Picture and Video Exhibition
51219,Postproduction Services and Other Motion Picture and Video Industries
51223,Music Publishers
51224,Sound Recording Studios
51225,Record Production and Distribution
51229,Other Sound Recording Industries
51311,Newspaper Publishers
51312,Periodical Publishers
51313,Book Publishers
51314,Directory and Mailing List Publishers
51319,Other Publishers
51321,Software Publishers
51611,Radio Broadcasting Stations
51612,Television Broadcasting Stations
51621,"Media Streaming Distribution Services, Social Networks, and Other Media Networks and Content Providers"
51711,Wired and Wireless Telecommunications Carriers (except Satellite)
51712,Telecommunications Resellers and Agents for Wireless Telecommunication Services
51741,Satellite Telecommunications
51781,All Other Telecommunications
51821,"Computing Infrastructure Providers, Data Processing, Web Hosting, and Related Services"
51921,Libraries and Archives
51929,Web Search Portals and All Other Information Services
52111,Monetary Authorities-Central Bank
52211,Commercial Banking
52213,Credit Unions
52218,Savings Institutions and Other Depository Credit Intermediation
52221,Credit Card Issuing
52222,Sales Financing
52229,Other Nondepository Credit Intermediation
52231,Mortgage and Nonmortgage Loan Brokers
52232,"Financial Transactions Processing, Reserve, and Clearinghouse Activities"
52239,Other Activities Related to Credit Intermediation
52315,Investment Banking and Securities Intermediation
52316,Commodity Contracts Intermediation
52321,Securities and Commodity Exchanges
52391,Miscellaneous Intermediation
52394,Portfolio Management and Investment Advice
52399,All Other Financial Investment Activities
52411,"Direct Life, Health, and Medical Insurance Carriers"
52412,"Direct Insurance (except Life, Health, and Medical) Carriers"
52413,Reinsurance Carriers
52421,Insurance Agencies and Brokerages
52429,Other Insurance Related Activities
52511,Pension Funds
52512,Health and Welfare Funds
52519,Other Insurance Funds
52591,Open-End Investment Funds
52592,"Trusts, Estates, and Agency Accounts"
52599,Other Financial Vehicles
53111,Lessors of Residential Buildings and Dwellings
53112,Lessors of Nonresidential Buildings (except Miniwarehouses)
53113,Lessors of Miniwarehouses and Self-Storage Units
53119,Lessors of Other Real Estate Property
53121,Offices of Real Estate Agents and Brokers
53131,Real Estate Property Managers
53132,Offices of Real Estate Appraisers
53139,Other Activities Related to Real Estate
53211,Passenger Car Rental and Leasing
53212,"Truck, Utility Trailer, and RV (Recreational Vehicle) Rental and Leasing"
53221,Consumer Electronics and Appliances Rental
53228,Other Consumer Goods Rental
53231,General Rental Centers
53241,"Construction, Transportation, Mining, and Forestry Machinery and Equipment Rental and Leasing"
53242,Office Machinery and Equipment Rental and Leasing
53249,Other Commercial and Industrial Machinery and Equipment Rental and Leasing
53311,Lessors of Nonfinancial Intangible Assets (except Copyrighted Works)
54111,Offices of Lawyers
54112,Offices of Notaries
54119,Other Legal Services
54121,"Accounting, Tax Preparation, Bookkeeping, and Payroll Services"
54131,Architectural Services
54132,Landscape Architectural Services
54133,Engineering Services
54134,Drafting Services
54135,Building Inspection Services
54136,Geophysical Surveying and Mapping Services
54137,Surveying and Mapping (except Geophysical) Services
54138,Testing Laboratories and Services
54141,Interior Design Services
54142,Industrial Design Services
54143,Graphic Design Services
54149,Other Specialized Design Services
54151,Computer Systems Design and Related Services
54161,Management Consulting Services
54162,Environmental Consulting Services
54169,Other Scientific and Technical Consulting Services
54171,"Research and Development in the Physical, Engineering, and Life Sciences"
54172,Research and Development in the Social Sciences and Humanities
54181,Advertising Agencies
54182,Public Relations Agencies
54183,Media Buying Agencies
54184,Media Representatives
54185,Indoor and Outdoor Display Advertising
54186,Direct Mail Advertising
54187,Advertising Material Distribution Services
54189,Other Services Related to Advertising
54191,Marketing Research and Public Opinion Polling
54192,Photographic Services
54193,Translation and Interpretation Services
54194,Veterinary Services
54199,"All Other Professional, Scientific, and Technical Services"
55111,Management of Companies and Enterprises
56111,Office Administrative Services
56121,Facilities Support Services
56131,Employment Placement Agencies and Executive Search Services
56132,Temporary Help Services
56133,Professional Employer Organizations
56141,Document Preparation Services
56142,Telephone Call Centers
56143,Business Service Centers
56144,Collection Agencies
56145,Credit Bureaus
56149,Other Business Support Services
56151,Travel Agencies
56152,Tour Operators
56159,Other Travel Arrangement and Reservation Services
56161,"Investigation, Guard, and Armored Car Services"
56162,Security Systems Services
56171,Exterminating and Pest Control Services
56172,Janitorial Services
56173,Landscaping Services
56174,Carpet and Upholstery Cleaning Services
56179,Other Services to Buildings and Dwellings
56191,Packaging and Labeling Services
56192,Convention and Trade Show Organizers
56199,All Other Support Services
56211,Waste Collection
56221,Waste Treatment and Disposal
56291,Remediation Services
56292,Materials Recovery Facilities
56299,All Other Waste Management Services
61111,Elementary and Secondary Schools
61121,Junior Colleges
61131,"Colleges, Universities, and Professional Schools"
61141,Business and Secretarial Schools
61142,Computer Training
61143,Professional and Management Development Training
61151,Technical and Trade Schools
61161,Fine Arts Schools
61162,Sports and Recreation Instruction
61163,Language Schools
61169,All Other Schools and Instruction
61171,Educational Support Services
62111,Offices of Physicians
62121,Offices of Dentists
62131,Offices of Chiropractors
62132,Offices of Optometrists
62133,Offices of Mental Health Practitioners (except Physicians)
62134,"Offices of Physical, Occupational and Speech Therapists, and Audiologists"
62139,Offices of All Other Health Practitioners
62141,Family Planning Centers
62142,Outpatient Mental Health and Substance Abuse Centers
62149,Other Outpatient Care Centers
62151,Medical and Diagnostic Laboratories
62161,Home Health Care Services
62191,Ambulance Services
62199,All Other Ambulatory Health Care Services
62211,General Medical and Surgical Hospitals
